,latitude,longitude,address
431,55.72666420962799,37.76689300759339,"город Москва, улица Михайлова, дом 18, корпус 1"
432,55.79493510586012,37.569400776639874,"город Москва, Петровско-Разумовский проезд, дом 10"
433,55.80249014547146,37.56668606083208,"город Москва, Петровско-Разумовский проезд, дом 24, корпус 1"
434,55.844486324768994,37.429936770645334,"город Москва, улица Фабрициуса, дом 44, корпус 1"
435,55.8531599948832,37.501110092399045,"город Москва, Флотская улица, дом 46"
436,55.86585825854297,37.70052369477811,"город Москва, Ярославское шоссе, дом 63"
437,55.87867889832357,37.71924353792267,"город Москва, Ярославское шоссе, дом 135"
438,55.79976238505459,37.78098737606794,"город Москва, 3-я Парковая улица, дом 41А, строение 13"
439,55.88096,37.712282,"город Москва, улица Егора Абакумова, дом 15А"
440,55.71066886574803,37.59802777928999,"город Москва, улица Орджоникидзе, дом 6/9"
441,55.75454142362452,37.81519802414443,"город Москва, Федеративный проспект, дом 34, корпус 1"
442,55.54457793837358,37.52254227457939,"город Москва, улица Адмирала Лазарева, дом 40"
443,55.686191485905134,37.54421495292133,"город Москва, Ленинский проспект, дом 75А"
444,55.616309746272215,37.70642035554878,"город Москва, Домодедовская улица, дом 1, корпус 1"
445,55.72934106290517,37.66776735479338,"город Москва, 1-я Дубровская улица, дом 2Б, корпус 1"
446,55.797249639592565,37.769902608949785,"город Москва, Измайловский проезд, дом 16, корпус 2"
447,55.80047923054287,37.77119236703626,"город Москва, Измайловский проезд, дом 24, корпус 1"
448,55.86909321104871,37.495751355931866,"город Москва, Клинская улица, дом 12"
449,55.805976759439766,37.70958693440434,"город Москва, Краснобогатырская улица, дом 79"
450,55.82389181653226,37.756086599167425,"город Москва, Открытое шоссе, дом 21, корпус 4"
451,55.82389181653226,37.756086599167425,"город Москва, Открытое шоссе, дом 21, корпус 4"
452,55.8013610129528,37.79434433721277,"город Москва, 7-я Парковая улица, дом 28"
453,55.601877268163015,37.58836686441781,"город Москва, Чертановская улица, дом 58, корпус 1"
454,55.57802028108443,37.57634260907665,"город Москва, Старобитцевская улица, дом 21, корпус 2"
455,55.56853314693668,37.56439242058369,"город Москва, улица Грина, дом 15"
456,55.54457793837358,37.52254227457939,"город Москва, улица Адмирала Лазарева, дом 40"
457,55.56436180153891,37.57114112647747,"город Москва, бульвар Дмитрия Донского, дом 16"
458,55.56726,37.47571,"город Москва, поселение Сосенское, посёлок Коммунарка, Ясная улица, дом 5"
459,55.55095139066108,37.55408430517004,"город Москва, Скобелевская улица, дом 4"
460,55.87657490237082,37.7205098599318,"город Москва, Ярославское шоссе, дом 142, корпус 5"
461,55.67614149898484,37.52629005709825,"город Москва, Ленинский проспект, дом 88"
462,55.54206082628394,37.54467355936872,"город Москва, Чечёрский проезд, дом 8"
463,55.84174441426769,37.378866020599276,"город Москва, Пятницкое шоссе, дом 15, корпус 4"
464,55.57136603805898,37.57392802982537,"город Москва, улица Знаменские Садки, дом 1А"
465,55.59631374238794,37.61448792027928,"город Москва, Россошанская улица, дом 13, корпус 1"
466,55.876392001474784,37.65136221120256,"город Москва, Сухонская улица, дом 7А"
467,55.81262624892123,37.57729442334977,"город Москва, Дмитровское шоссе, дом 5, корпус 1"
468,55.79745404198409,37.796217786282064,"город Москва, Измайловский бульвар, дом 37"
469,55.78685712113624,37.51200311481839,"город Москва, улица Куусинена, дом 19, корпус 1"
470,55.750012567499766,37.799889512097096,"город Москва, Новогиреевская улица, дом 48"
471,55.847223094809934,37.45320575538725,"город Москва, улица Свободы, дом 45, строение 1"
472,55.858285199683486,37.4449308855042,"город Москва, улица Фомичёвой, дом 8"
473,55.773981373409626,37.53713300148441,"город Москва, 3-й Хорошёвский проезд, дом 10"
474,55.62817442624714,37.67697635134401,"город Москва, Ереванская улица, дом 26, корпус 1"
475,55.706681,37.46711,"город Москва, Нежинская улица, дом 17, корпус 2"
476,55.671326,37.517033,"город Москва, улица Удальцова, дом 1"
477,55.80339431375716,37.63123067604084,"город Москва, улица Годовикова, дом 2А"
478,55.507005705590444,37.56775770863274,"город Москва, город Щербинка, Юбилейная улица, дом 8"
479,55.50217809475337,37.5448232407306,"город Москва, город Щербинка, улица Барышевская Роща, дом 22"
